{
  "scenes": {
    "prologue": "序章·雨夜：你在山道上走了一整天，终于望见山坳里透出灯火——「灯下谜径」客栈到了。推门时门轴吱呀作响，风铃轻晃。",
    "tavern": "酒馆·大堂：壁炉噼啪作响，掌柜擦着一只旧铜提灯，灯光昏黄。桌上留着前任房客的地图残页，一角画着地下室的暗门。",
    "crossroad": "岔路·后廊：酒馆后廊尽头分出两条路——左边的石阶向下没入黑暗（通往地窖），右边的木梯向上通向温暖的客房。风从地窖方向吹来，带着潮湿的土腥味。",
    "cellar_dark": "地窖·黑暗中：你摸黑走下石阶，第三级台阶上覆着湿苔。脚下一滑，重重摔在石地上——黑暗里什么也看不清，你决定不再冒险。",
    "cellar_lit": "地窖·灯光所及：提灯的光晕推开黑暗。石阶尽头立着一扇刻满星图的暗门，门缝里透出微光——这正是地图残页上标记的「灯下秘藏」。",
    "inn": "客栈·客房：你推开客房的门，炉火已生好，被褥干燥。窗外的雨声渐密，你把地图残页压在灯座下，明天再说。"
  },
  "endings": {
    "a": "【结局A】灯下秘藏：暗门在你掌下缓缓开启，星图与灯光在门楣上重合。前任房客留下的手记摊在石台上——你找到了他毕生追寻的答案。",
    "b": "【结局B】平安一夜：你在温暖的客房里安然入睡。秘密仍在地窖深处沉睡，但今夜无人受伤——有时平安也是一种结局。",
    "c": "【结局C】暗巷折返：黑暗吞没了你。你带着摔痛的腿爬回大堂，掌柜摇头叹气：『没灯就该等天亮。』冒险以狼狈告终。"
  },
  "prompts": {
    "tavern": "掌柜把铜提灯推向你：『地窖黑得很，带上它吧？』",
    "crossroad": "后廊岔路——你的脚步停在哪里？"
  },
  "options": {
    "tavern_yes": "接过提灯",
    "tavern_no": "轻装出发",
    "crossroad_cellar": "沿石阶下地窖",
    "crossroad_inn": "上楼回客房"
  },
  "beats": {
    "lantern_taken": "你接过提灯。灯芯点燃，一小团暖光随你而行。",
    "lantern_left": "你谢绝了提灯，只凭窗外的微光辨路。",
    "cellar_choice_hint": "你的选择已定——脚步声在走廊里回响。"
  },
  "tuning": {
    "dark_fall_damage": 3
  }
}
